<?xml version="1.0" encoding="UTF-8"?>
<tns:patient xmlns:tns="http://www.kn.org/Patient"
	xmlns:xsi="http://www.w3.org/2001/XMLSchema-instance"
	xsi:schemaLocation="http://www.kn.org/Patient Patient.xsd ">
	<tns:id>123</tns:id>
	<tns:name>tns:name</tns:name>
	<tns:phone>tns:phone</tns:phone>
	<tns:age>0</tns:age>
	<tns:dob>2001-01-01</tns:dob>
	<tns:gender>M</tns:gender>
	<tns:email>tns:email</tns:email>
	<tns:payment>
		<tns:inshurance>
			<tns:provider>Test Provider</tns:provider>
			<tns:limit>1000</tns:limit>
		</tns:inshurance>
	</tns:payment>
</tns:patient>
